
Bus 005 Device 004: ID 0db0:6a05 Micro Star International MEG Core Liquid S360
Negotiated speed: Full Speed (12Mbps)
Device Descriptor:
  bLength                18
  bDescriptorType         1
  bcdUSB               2.00
  bDeviceClass            0 [unknown]
  bDeviceSubClass         0 [unknown]
  bDeviceProtocol         0 
  bMaxPacketSize0        64
  idVendor           0x0db0 Micro Star International
  idProduct          0x6a05 MEG Core Liquid S360
  bcdDevice            1.00
  iManufacturer           1 MSI
  iProduct                2 MEG Core Liquid S360
  iSerial                 3 A02021031800
  bNumConfigurations      1
  Configuration Descriptor:
    bLength                 9
    bDescriptorType         2
    wTotalLength       0x0040
    bNumInterfaces          2
    bConfigurationValue     1
    iConfiguration          0 
    bmAttributes         0x80
      (Bus Powered)
    MaxPower              500mA
    Interface Descriptor:
      bLength                 9
      bDescriptorType         4
      bInterfaceNumber        0
      bAlternateSetting       0
      bNumEndpoints           2
      bInterfaceClass       255 Vendor Specific Class
      bInterfaceSubClass    255 Vendor Specific Subclass
      bInterfaceProtocol      0 
      iInterface              0 
      Endpoint Descriptor:
        bLength                 7
        bDescriptorType         5
        bEndpointAddress     0x83  EP 3 IN
        bmAttributes            2
          Transfer Type            Bulk
          Synch Type               None
          Usage Type               Data
        wMaxPacketSize     0x0040  1x 64 bytes
        bInterval               0
      Endpoint Descriptor:
        bLength                 7
        bDescriptorType         5
        bEndpointAddress     0x04  EP 4 OUT
        bmAttributes            2
          Transfer Type            Bulk
          Synch Type               None
          Usage Type               Data
        wMaxPacketSize     0x0040  1x 64 bytes
        bInterval               0
    Interface Descriptor:
      bLength                 9
      bDescriptorType         4
      bInterfaceNumber        1
      bAlternateSetting       0
      bNumEndpoints           2
      bInterfaceClass         3 Human Interface Device
      bInterfaceSubClass      0 [unknown]
      bInterfaceProtocol      0 
      iInterface              0 
        HID Device Descriptor:
          bLength                 9
          bDescriptorType        33
          bcdHID               1.10
          bCountryCode            0 Not supported
          bNumDescriptors         1
          bDescriptorType        34 (null)
          wDescriptorLength     154
          Report Descriptor: (length is 154)
            Item(Global): Usage Page, data= [ 0x01 ] 1
                            (null)
            Item(Local ): (null), data= [ 0x00 ] 0
                            Undefined
            Item(Main  ): (null), data= [ 0x01 ] 1
                            Application
            Item(Global): (null), data= [ 0x01 ] 1
            Item(Global): (null), data= [ 0x00 ] 0
            Item(Global): (null), data= [ 0xff ] 255
            Item(Local ): (null), data= [ 0x01 ] 1
                            (null)
            Item(Local ): (null), data= [ 0x08 ] 8
                            (null)
            Item(Global): (null), data= [ 0x3f ] 63
            Item(Global): (null), data= [ 0x08 ] 8
            Item(Main  ): (null), data= [ 0x02 ] 2
                            Data Variable Absolute No_Wrap Linear
                            Preferred_State No_Null_Position Non_Volatile Bitfield
            Item(Local ): (null), data= [ 0x01 ] 1
                            (null)
            Item(Local ): (null), data= [ 0x08 ] 8
                            (null)
            Item(Main  ): (null), data= [ 0x02 ] 2
                            Data Variable Absolute No_Wrap Linear
                            Preferred_State No_Null_Position Non_Volatile Bitfield
            Item(Global): (null), data= [ 0x02 ] 2
            Item(Global): (null), data= [ 0x00 ] 0
            Item(Global): (null), data= [ 0xff ] 255
            Item(Local ): (null), data= [ 0x01 ] 1
                            (null)
            Item(Local ): (null), data= [ 0x08 ] 8
                            (null)
            Item(Global): (null), data= [ 0x3f ] 63
            Item(Global): (null), data= [ 0x08 ] 8
            Item(Main  ): (null), data= [ 0x02 ] 2
                            Data Variable Absolute No_Wrap Linear
                            Preferred_State No_Null_Position Non_Volatile Bitfield
            Item(Local ): (null), data= [ 0x01 ] 1
                            (null)
            Item(Local ): (null), data= [ 0x08 ] 8
                            (null)
            Item(Main  ): (null), data= [ 0x02 ] 2
                            Data Variable Absolute No_Wrap Linear
                            Preferred_State No_Null_Position Non_Volatile Bitfield
            Item(Global): (null), data= [ 0xd0 ] 208
            Item(Global): (null), data= [ 0x00 ] 0
            Item(Global): (null), data= [ 0xff ] 255
            Item(Local ): (null), data= [ 0x01 ] 1
                            (null)
            Item(Local ): (null), data= [ 0x08 ] 8
                            (null)
            Item(Global): (null), data= [ 0x3f ] 63
            Item(Global): (null), data= [ 0x08 ] 8
            Item(Main  ): (null), data= [ 0x02 ] 2
                            Data Variable Absolute No_Wrap Linear
                            Preferred_State No_Null_Position Non_Volatile Bitfield
            Item(Local ): (null), data= [ 0x01 ] 1
                            (null)
            Item(Local ): (null), data= [ 0x08 ] 8
                            (null)
            Item(Main  ): (null), data= [ 0x02 ] 2
                            Data Variable Absolute No_Wrap Linear
                            Preferred_State No_Null_Position Non_Volatile Bitfield
            Item(Global): (null), data= [ 0xfa ] 250
            Item(Global): (null), data= [ 0x00 ] 0
            Item(Global): (null), data= [ 0xff ] 255
            Item(Local ): (null), data= [ 0x01 ] 1
                            (null)
            Item(Local ): (null), data= [ 0x08 ] 8
                            (null)
            Item(Global): (null), data= [ 0x3f ] 63
            Item(Global): (null), data= [ 0x08 ] 8
            Item(Main  ): (null), data= [ 0x02 ] 2
                            Data Variable Absolute No_Wrap Linear
                            Preferred_State No_Null_Position Non_Volatile Bitfield
            Item(Local ): (null), data= [ 0x01 ] 1
                            (null)
            Item(Local ): (null), data= [ 0x08 ] 8
                            (null)
            Item(Main  ): (null), data= [ 0x02 ] 2
                            Data Variable Absolute No_Wrap Linear
                            Preferred_State No_Null_Position Non_Volatile Bitfield
            Item(Global): (null), data= [ 0xfc ] 252
            Item(Global): (null), data= [ 0x00 ] 0
            Item(Global): (null), data= [ 0xff ] 255
            Item(Local ): (null), data= [ 0x01 ] 1
                            (null)
            Item(Local ): (null), data= [ 0x08 ] 8
                            (null)
            Item(Global): (null), data= [ 0x3f ] 63
            Item(Global): (null), data= [ 0x08 ] 8
            Item(Main  ): (null), data= [ 0x02 ] 2
                            Data Variable Absolute No_Wrap Linear
                            Preferred_State No_Null_Position Non_Volatile Bitfield
            Item(Local ): (null), data= [ 0x01 ] 1
                            (null)
            Item(Local ): (null), data= [ 0x08 ] 8
                            (null)
            Item(Main  ): (null), data= [ 0x02 ] 2
                            Data Variable Absolute No_Wrap Linear
                            Preferred_State No_Null_Position Non_Volatile Bitfield
            Item(Global): Usage Page, data= [ 0x00 0xff ] 65280
                            (null)
            Item(Local ): (null), data= [ 0x01 ] 1
                            (null)
            Item(Main  ): (null), data= [ 0x01 ] 1
                            Application
            Item(Global): (null), data= [ 0x52 ] 82
            Item(Local ): (null), data= [ 0x01 ] 1
                            (null)
            Item(Global): (null), data= [ 0x00 ] 0
            Item(Global): (null), data= [ 0xff ] 255
            Item(Global): (null), data= [ 0x08 ] 8
            Item(Global): (null), data= [ 0xb8 ] 184
            Item(Main  ): (null), data= [ 0x02 ] 2
                            Data Variable Absolute No_Wrap Linear
                            Preferred_State No_Null_Position Non_Volatile Bitfield
            Item(Global): (null), data= [ 0x53 ] 83
            Item(Local ): (null), data= [ 0x01 ] 1
                            (null)
            Item(Global): (null), data= [ 0x00 ] 0
            Item(Global): (null), data= [ 0xff ] 255
            Item(Global): (null), data= [ 0x08 ] 8
            Item(Global): (null), data= [ 0xd4 0x02 ] 724
            Item(Main  ): (null), data= [ 0x02 ] 2
                            Data Variable Absolute No_Wrap Linear
                            Preferred_State No_Null_Position Non_Volatile Bitfield
            Item(Main  ): (null), data=none
            Item(Main  ): (null), data=none
      Endpoint Descriptor:
        bLength                 7
        bDescriptorType         5
        bEndpointAddress     0x81  EP 1 IN
        bmAttributes            3
          Transfer Type            Interrupt
          Synch Type               None
          Usage Type               Data
        wMaxPacketSize     0x0040  1x 64 bytes
        bInterval               5
      Endpoint Descriptor:
        bLength                 7
        bDescriptorType         5
        bEndpointAddress     0x02  EP 2 OUT
        bmAttributes            3
          Transfer Type            Interrupt
          Synch Type               None
          Usage Type               Data
        wMaxPacketSize     0x0040  1x 64 bytes
        bInterval               5
Device Qualifier (for other device speed):
  bLength                10
  bDescriptorType         6
  bcdUSB               2.00
  bDeviceClass            0 [unknown]
  bDeviceSubClass         0 [unknown]
  bDeviceProtocol         0 
  bMaxPacketSize0        64
  bNumConfigurations      1
Device Status:     0x0000
  (Bus Powered)

Bus 005 Device 005: ID 0db0:9ba6 Micro Star International USB HID
Negotiated speed: High Speed (480Mbps)
Device Descriptor:
  bLength                18
  bDescriptorType         1
  bcdUSB               1.10
  bDeviceClass            0 [unknown]
  bDeviceSubClass         0 [unknown]
  bDeviceProtocol         0 
  bMaxPacketSize0        64
  idVendor           0x0db0 Micro Star International
  idProduct          0x9ba6 USB HID
  bcdDevice            0.00
  iManufacturer           1 nuvoTon
  iProduct                2 USB HID
  iSerial                 0 
  bNumConfigurations      1
  Configuration Descriptor:
    bLength                 9
    bDescriptorType         2
    wTotalLength       0x0029
    bNumInterfaces          1
    bConfigurationValue     1
    iConfiguration          0 
    bmAttributes         0x80
      (Bus Powered)
    MaxPower              100mA
    Interface Descriptor:
      bLength                 9
      bDescriptorType         4
      bInterfaceNumber        0
      bAlternateSetting       0
      bNumEndpoints           2
      bInterfaceClass         3 Human Interface Device
      bInterfaceSubClass      0 [unknown]
      bInterfaceProtocol      0 
      iInterface              0 
        HID Device Descriptor:
          bLength                 9
          bDescriptorType        33
          bcdHID               1.10
          bCountryCode            0 Not supported
          bNumDescriptors         1
          bDescriptorType        34 (null)
          wDescriptorLength      36
          Report Descriptors: 
            ** UNAVAILABLE **
      Endpoint Descriptor:
        bLength                 7
        bDescriptorType         5
        bEndpointAddress     0x81  EP 1 IN
        bmAttributes            3
          Transfer Type            Interrupt
          Synch Type               None
          Usage Type               Data
        wMaxPacketSize     0x0200  1x 512 bytes
        bInterval               1
      Endpoint Descriptor:
        bLength                 7
        bDescriptorType         5
        bEndpointAddress     0x02  EP 2 OUT
        bmAttributes            3
          Transfer Type            Interrupt
          Synch Type               None
          Usage Type               Data
        wMaxPacketSize     0x0400  1x 1024 bytes
        bInterval               1
Device Status:     0x0001
  Self Powered

